{"contract":{"version":"2.0","schema_version":"2.0","description":"Test"},"source":{"system_type":"manual","system_name":"Test","generated_by":"Test","generated_at":"2026-07-01T00:00:00Z"},"plant":{"plant_id":"TEST","plant_code":"TEST","name":"Test Plant","timezone":"UTC"},"areas":[{"area_id":"AREA1","area_code":"AREA1","name":"Area 1","plant_id":"TEST"}],"assets":[{"asset_id":"PUMP01","asset_code":"PUMP01","name":"Pump","asset_type":"pump","area_id":"AREA1"}],"signals":[{"signal_id":"PUMP01.speed","asset_id":"PUMP01","signal_name":"speed","display_name":"Speed","signal_type":"measurement","data_type":"float","engineering_unit":"RPM"}],"uns":{"namespace_root":"test","path_template":"{namespace_root}/{plant_id}/{signal_name}"},"import_recommendation":{"suggested_mode":"validate_only","reason":"test"}}
