{"contract":{"version":"2.0","schema_version":"2.0","description":"VF-DEMO preview test"},"source":{"system_type":"manual","system_name":"Test","generated_by":"Test","generated_at":"2026-07-01T00:00:00Z"},"plant":{"plant_id":"VF-DEMO","plant_code":"VF-DEMO","name":"Virtual Factory Demo","timezone":"Asia/Ho_Chi_Minh"},"areas":[{"area_id":"COMPRESSOR-AREA","area_code":"CA","name":"Compressor Area","plant_id":"VF-DEMO"}],"assets":[{"asset_id":"COMP01","asset_code":"C01","name":"Compressor","asset_type":"compressor_train","area_id":"COMPRESSOR-AREA"}],"signals":[{"signal_id":"COMP01.speed","asset_id":"COMP01","signal_name":"speed","display_name":"Speed","signal_type":"measurement","data_type":"float","engineering_unit":"RPM"}],"uns":{"namespace_root":"avenue","path_template":"{namespace_root}/{plant_id}/{signal_name}"},"import_recommendation":{"suggested_mode":"preview","reason":"test conflict"}}
